{
  "buyer": {
    "commitment": "o8d7eFF6kEARvjqqsK_13BuWTdoaByHY7IKLYbhNMfk",
    "identifier_type": "issuer-account",
    "pubkey": null
  },
  "issued_at": "2025-07-02T13:50:00Z",
  "issuer": {
    "display_name": "Example Games Store",
    "id": "store.example.com"
  },
  "license": {
    "drm": "drm-free",
    "grant": "perpetual",
    "legal_text_sha256": "fd626193eb454bce229584a139d223f8e15f2b0c4693739b81fa31ea330d6bc2",
    "revocability": "none",
    "terms_uri": "https://store.example.com/opr/license-templates/standard-v1",
    "transferable": false
  },
  "opr_version": "0.1",
  "receipt_id": "01JZ5PDHT0000G40R40M30E209",
  "supersedes": null,
  "survivability": {
    "end_of_life": "artifacts-remain-redownloadable",
    "eol_commitment_sha256": null,
    "eol_commitment_uri": null,
    "redownload_right": true
  },
  "work": {
    "artifact_series": "store.example.com/works/EXG-001",
    "identifiers": {
      "issuer_sku": "EXG-001"
    },
    "publisher": "Example Publisher srl",
    "title": "Example Game"
  }
}
